fund_name,manager_name,fund_strategy,target_size_display,target_size_millions,currency,expected_quarter,expected_year,status,source_file,source_page,raw_line,quality_score,quality_reason
EagleTree Partners VI 1.2bn 2022,RUBICON Technology Partners IV 1.7bn 2022,,1.2bn,1200.0,,,,Potential future fund,UBS PFG - Global Funds Coming to Market_Q1 2026.pdf,10,EagleTree Partners VI 1.2bn 2022,70,real fund name; manager found; target size found
Industrial Growth Partners VI 1.2bn 2022,EagleTree Partners VI 1.2bn 2022,"growth, industrial",1.2bn,1200.0,,,,Potential future fund,UBS PFG - Global Funds Coming to Market_Q1 2026.pdf,10,Industrial Growth Partners VI 1.2bn 2022,70,real fund name; manager found; target size found
Serent Capital V 1.1bn 2022,Industrial Growth Partners VI 1.2bn 2022,,1.1bn,1100.0,,,,Potential future fund,UBS PFG - Global Funds Coming to Market_Q1 2026.pdf,10,Serent Capital V 1.1bn 2022,70,real fund name; manager found; target size found
Arsenal Small Cap Fund 1.1bn 2022,Serent Capital V 1.1bn 2022,,1.1bn,1100.0,,,,Potential future fund,UBS PFG - Global Funds Coming to Market_Q1 2026.pdf,10,Arsenal Small Cap Fund 1.1bn 2022,70,real fund name; manager found; target size found
Mill Point Capital Partners III 1.7bn,,,1.7bn,1700.0,,,,Potential future fund,UBS PFG - Global Funds Coming to Market_Q1 2026.pdf,11,Mill Point Capital Partners III 1.7bn 2024,70,real fund name; manager found; target size found
Kingswood Capital Opportunities Fund III 1.5bn,,,1.5bn,1500.0,,,,Potential future fund,UBS PFG - Global Funds Coming to Market_Q1 2026.pdf,11,Kingswood Capital Opportunities Fund III 1.5bn 2024,70,real fund name; manager found; target size found
Shamrock Capital Growth Fund VI 1.3bn,,growth,1.3bn,1300.0,,,,Potential future fund,UBS PFG - Global Funds Coming to Market_Q1 2026.pdf,11,Shamrock Capital Growth Fund VI 1.3bn 2024,70,real fund name; manager found; target size found
GSP 5.0 Fund 1.2bn,,,1.2bn,1200.0,,,,Potential future fund,UBS PFG - Global Funds Coming to Market_Q1 2026.pdf,11,GSP 5.0 Fund 1.2bn 2024,70,real fund name; manager found; target size found
CenterOak Partners Fund III 1.1bn,,,1.1bn,1100.0,,,,Potential future fund,UBS PFG - Global Funds Coming to Market_Q1 2026.pdf,11,CenterOak Partners Fund III 1.1bn 2024,70,real fund name; manager found; target size found
LightBay Investment Partners II 1.0bn 2023,Greenbelt Capital Partners III 1.0bn 2023,,1.0bn,1000.0,,,,Potential future fund,UBS PFG - Global Funds Coming to Market_Q1 2026.pdf,11,LightBay Investment Partners II 1.0bn 2023,70,real fund name; manager found; target size found
SkyKnight Capital Fund IV 1.0bn 2023,LightBay Investment Partners II 1.0bn 2023,,1.0bn,1000.0,,,,Potential future fund,UBS PFG - Global Funds Coming to Market_Q1 2026.pdf,11,SkyKnight Capital Fund IV 1.0bn 2023,70,real fund name; manager found; target size found
Norwest Equity Partners XI 1.0bn,,,1.0bn,1000.0,,,,Potential future fund,UBS PFG - Global Funds Coming to Market_Q1 2026.pdf,11,Norwest Equity Partners XI 1.0bn 2024,70,real fund name; manager found; target size found
Excellere Partners IV 875m 2021,,,875m,875.0,,,,Potential future fund,UBS PFG - Global Funds Coming to Market_Q1 2026.pdf,12,Excellere Partners IV 875m 2021,70,real fund name; manager found; target size found
Carousel Capital Partners VII 850m* Raising,,,850m,850.0,,,,Potential future fund,UBS PFG - Global Funds Coming to Market_Q1 2026.pdf,12,Carousel Capital Partners VII 850m* Raising,70,real fund name; manager found; target size found
Endeavour Capital Fund VIII 850m 2021,Excellere Partners IV 875m 2021,,850m,850.0,,,,Potential future fund,UBS PFG - Global Funds Coming to Market_Q1 2026.pdf,12,Endeavour Capital Fund VIII 850m 2021,70,real fund name; manager found; target size found
Center Rock Capital Partners Fund II 750m* Held Close,Atlantic Street Capital V 750m* Held Close,,750m,750.0,,,,Potential future fund,UBS PFG - Global Funds Coming to Market_Q1 2026.pdf,12,Center Rock Capital Partners Fund II 750m* Held Close,70,real fund name; manager found; target size found
ICV Partners V 750m* Held Close,,,750m,750.0,,,,Potential future fund,UBS PFG - Global Funds Coming to Market_Q1 2026.pdf,12,ICV Partners V 750m* Held Close,70,real fund name; manager found; target size found
Vector Capital VI 750m* Held Close,ICV Partners V 750m* Held Close,,750m,750.0,,,,Potential future fund,UBS PFG - Global Funds Coming to Market_Q1 2026.pdf,12,Vector Capital VI 750m* Held Close,70,real fund name; manager found; target size found
Kinderhook Strategic Opportunities Fund I 750m* Raising,Carousel Capital Partners VII 850m* Raising,,750m,750.0,,,,Potential future fund,UBS PFG - Global Funds Coming to Market_Q1 2026.pdf,12,Kinderhook Strategic Opportunities Fund I 750m* Raising,70,real fund name; manager found; target size found
Influence X Music Fund III 750m* Raising,Carousel Capital Partners VII 850m* Raising,,750m,750.0,,,,Potential future fund,UBS PFG - Global Funds Coming to Market_Q1 2026.pdf,12,Influence X Music Fund III 750m* Raising,70,real fund name; manager found; target size found
Yellow Wood Partners Fund III 750m 2020,,,750m,750.0,,,,Potential future fund,UBS PFG - Global Funds Coming to Market_Q1 2026.pdf,12,Yellow Wood Partners Fund III 750m 2020,70,real fund name; manager found; target size found
CIP Capital Fund III 700m* Raising,Carousel Capital Partners VII 850m* Raising,,700m,700.0,,,,Potential future fund,UBS PFG - Global Funds Coming to Market_Q1 2026.pdf,12,CIP Capital Fund III 700m* Raising,70,real fund name; manager found; target size found
Beekman Investment Partners V 550m* Held Close,Vector Capital VI 750m* Held Close,,550m,550.0,,,,Potential future fund,UBS PFG - Global Funds Coming to Market_Q1 2026.pdf,12,Beekman Investment Partners V 550m* Held Close,70,real fund name; manager found; target size found
Soundcore Capital Partners Fund III 550m* Held Close,Beekman Investment Partners V 550m* Held Close,,550m,550.0,,,,Potential future fund,UBS PFG - Global Funds Coming to Market_Q1 2026.pdf,12,Soundcore Capital Partners Fund III 550m* Held Close,70,real fund name; manager found; target size found
Trivest Partners VII 950m 2022,,,950m,950.0,,,,Potential future fund,UBS PFG - Global Funds Coming to Market_Q1 2026.pdf,13,Trivest Partners VII 950m 2022,70,real fund name; manager found; target size found
MSouth Equity Partners IV 940m 2019,Graycliff Private Equity Partners V 600m 2023,,940m,940.0,,,,Potential future fund,UBS PFG - Global Funds Coming to Market_Q1 2026.pdf,13,MSouth Equity Partners IV 940m 2019,70,real fund name; manager found; target size found
Capitol Meridian Fund I 900m 2022,Trivest Partners VII 950m 2022,,900m,900.0,,,,Potential future fund,UBS PFG - Global Funds Coming to Market_Q1 2026.pdf,13,Capitol Meridian Fund I 900m 2022,70,real fund name; manager found; target size found
Comvest Investment Partners VI 881m 2022,Trivest Partners VII 950m 2022,,881m,881.0,,,,Potential future fund,UBS PFG - Global Funds Coming to Market_Q1 2026.pdf,13,Comvest Investment Partners VI 881m 2022,70,real fund name; manager found; target size found
Consonance Private Equity II 856m 2020,MSouth Equity Partners IV 940m 2019,private equity,856m,856.0,,,,Potential future fund,UBS PFG - Global Funds Coming to Market_Q1 2026.pdf,13,Consonance Private Equity II 856m 2020,70,real fund name; manager found; target size found
Blue Point Capital Partners V 850m 2022,Comvest Investment Partners VI 881m 2022,,850m,850.0,,,,Potential future fund,UBS PFG - Global Funds Coming to Market_Q1 2026.pdf,13,Blue Point Capital Partners V 850m 2022,70,real fund name; manager found; target size found
Clearview Capital Fund V 850m 2022,Blue Point Capital Partners V 850m 2022,,850m,850.0,,,,Potential future fund,UBS PFG - Global Funds Coming to Market_Q1 2026.pdf,13,Clearview Capital Fund V 850m 2022,70,real fund name; manager found; target size found
NexPhase Capital Fund V 795m 2022,,,795m,795.0,,,,Potential future fund,UBS PFG - Global Funds Coming to Market_Q1 2026.pdf,13,NexPhase Capital Fund V 795m 2022,70,real fund name; manager found; target size found
Mason Wells Buyout Fund V 767m 2021,,buyout,767m,767.0,,,,Potential future fund,UBS PFG - Global Funds Coming to Market_Q1 2026.pdf,13,Mason Wells Buyout Fund V 767m 2021,70,real fund name; manager found; target size found
Haveli VC Gaming Fund I 760m 2022,,,760m,760.0,,,,Potential future fund,UBS PFG - Global Funds Coming to Market_Q1 2026.pdf,13,Haveli VC Gaming Fund I 760m 2022,70,real fund name; manager found; target size found
DC Capital Partners Fund III 750m 2021,,,750m,750.0,,,,Potential future fund,UBS PFG - Global Funds Coming to Market_Q1 2026.pdf,13,DC Capital Partners Fund III 750m 2021,70,real fund name; manager found; target size found
Main Post Growth Capital III 736m 2022,,growth,736m,736.0,,,,Potential future fund,UBS PFG - Global Funds Coming to Market_Q1 2026.pdf,13,Main Post Growth Capital III 736m 2022,70,real fund name; manager found; target size found
Gamut Investment Fund II 719m 2022,Main Post Growth Capital III 736m 2022,,719m,719.0,,,,Potential future fund,UBS PFG - Global Funds Coming to Market_Q1 2026.pdf,13,Gamut Investment Fund II 719m 2022,70,real fund name; manager found; target size found
Industrial Opportunity Partners IV 650m 2022,,industrial,650m,650.0,,,,Potential future fund,UBS PFG - Global Funds Coming to Market_Q1 2026.pdf,13,Industrial Opportunity Partners IV 650m 2022,70,real fund name; manager found; target size found
Align Capital Partners Fund III 620m 2022,Industrial Opportunity Partners IV 650m 2022,,620m,620.0,,,,Potential future fund,UBS PFG - Global Funds Coming to Market_Q1 2026.pdf,13,Align Capital Partners Fund III 620m 2022,70,real fund name; manager found; target size found
Clearhaven Fund II 580m 2023,Graycliff Private Equity Partners V 600m 2023,,580m,580.0,,,,Potential future fund,UBS PFG - Global Funds Coming to Market_Q1 2026.pdf,13,Clearhaven Fund II 580m 2023,70,real fund name; manager found; target size found
Coalesce Capital Fund I 900m 2023,,,900m,900.0,,,,Potential future fund,UBS PFG - Global Funds Coming to Market_Q1 2026.pdf,14,Coalesce Capital Fund I 900m 2023,70,real fund name; manager found; target size found
Frontenac XIII Private Capital 900m,,,900m,900.0,,,,Potential future fund,UBS PFG - Global Funds Coming to Market_Q1 2026.pdf,14,Frontenac XIII Private Capital 900m 2024,70,real fund name; manager found; target size found
CIVC Partners Fund VII 870m 2023,,,870m,870.0,,,,Potential future fund,UBS PFG - Global Funds Coming to Market_Q1 2026.pdf,14,CIVC Partners Fund VII 870m 2023,70,real fund name; manager found; target size found
GHK Fund II 870m 2023,,,870m,870.0,,,,Potential future fund,UBS PFG - Global Funds Coming to Market_Q1 2026.pdf,14,GHK Fund II 870m 2023,70,real fund name; manager found; target size found
McCarthy Capital Fund VIII 870m,,,870m,870.0,,,,Potential future fund,UBS PFG - Global Funds Coming to Market_Q1 2026.pdf,14,McCarthy Capital Fund VIII 870m 2024,70,real fund name; manager found; target size found
L Squared Capital Fund IV 840m 2023,,,840m,840.0,,,,Potential future fund,UBS PFG - Global Funds Coming to Market_Q1 2026.pdf,14,L Squared Capital Fund IV 840m 2023,70,real fund name; manager found; target size found
Hidden Harbor Capital Partners Fund III 800m,,,800m,800.0,,,,Potential future fund,UBS PFG - Global Funds Coming to Market_Q1 2026.pdf,14,Hidden Harbor Capital Partners Fund III 800m 2024,70,real fund name; manager found; target size found
Vance Street Fund IV 775m 2023,,,775m,775.0,,,,Potential future fund,UBS PFG - Global Funds Coming to Market_Q1 2026.pdf,14,Vance Street Fund IV 775m 2023,70,real fund name; manager found; target size found
Brynwood Partners IX 750m 2023,,,750m,750.0,,,,Potential future fund,UBS PFG - Global Funds Coming to Market_Q1 2026.pdf,14,Brynwood Partners IX 750m 2023,70,real fund name; manager found; target size found
Tower Arch Partners III 750m 2023,Brynwood Partners IX 750m 2023,,750m,750.0,,,,Potential future fund,UBS PFG - Global Funds Coming to Market_Q1 2026.pdf,14,Tower Arch Partners III 750m 2023,70,real fund name; manager found; target size found
Northlane Capital Partners III 750m,,,750m,750.0,,,,Potential future fund,UBS PFG - Global Funds Coming to Market_Q1 2026.pdf,14,Northlane Capital Partners III 750m 2024,70,real fund name; manager found; target size found
CORE Industrial Partners Fund III 685m,,industrial,685m,685.0,,,,Potential future fund,UBS PFG - Global Funds Coming to Market_Q1 2026.pdf,14,CORE Industrial Partners Fund III 685m 2024,70,real fund name; manager found; target size found
Blue Sea Capital Fund III 618m 2023,Tower Arch Partners III 750m 2023,,618m,618.0,,,,Potential future fund,UBS PFG - Global Funds Coming to Market_Q1 2026.pdf,14,Blue Sea Capital Fund III 618m 2023,70,real fund name; manager found; target size found
Silver Oak Services Fund IV 500m 2019,,,500m,500.0,,,,Potential future fund,UBS PFG - Global Funds Coming to Market_Q1 2026.pdf,15,Silver Oak Services Fund IV 500m 2019,70,real fund name; manager found; target size found
HCP Services Fund 450m* Held Close,Sorenson Capital Partners IV 500m* Held Close,,450m,450.0,,,,Potential future fund,UBS PFG - Global Funds Coming to Market_Q1 2026.pdf,15,HCP Services Fund 450m* Held Close,70,real fund name; manager found; target size found
Baird Capital Global Fund III 425m* Raising,,,425m,425.0,,,,Potential future fund,UBS PFG - Global Funds Coming to Market_Q1 2026.pdf,15,Baird Capital Global Fund III 425m* Raising,70,real fund name; manager found; target size found
HCI Equity Partners V 405m 2017,,,405m,405.0,,,,Potential future fund,UBS PFG - Global Funds Coming to Market_Q1 2026.pdf,15,HCI Equity Partners V 405m 2017,70,real fund name; manager found; target size found
Gainline Equity Fund II 400m 2021,Housatonic Equity Investors VII 241m 2020,,400m,400.0,,,,Potential future fund,UBS PFG - Global Funds Coming to Market_Q1 2026.pdf,15,Gainline Equity Fund II 400m 2021,70,real fund name; manager found; target size found
North Castle Partners VII 400m 2019,,,400m,400.0,,,,Potential future fund,UBS PFG - Global Funds Coming to Market_Q1 2026.pdf,15,North Castle Partners VII 400m 2019,70,real fund name; manager found; target size found
Quad Partners VI 388m 2021,,,388m,388.0,,,,Potential future fund,UBS PFG - Global Funds Coming to Market_Q1 2026.pdf,15,Quad Partners VI 388m 2021,70,real fund name; manager found; target size found
HKW Capital Partners V 365m 2019,North Castle Partners VII 400m 2019,,365m,365.0,,,,Potential future fund,UBS PFG - Global Funds Coming to Market_Q1 2026.pdf,15,HKW Capital Partners V 365m 2019,70,real fund name; manager found; target size found
Swan Investment Partners Fund I 300m* Held Close,Sorenson Capital Partners IV 500m* Held Close,,300m,300.0,,,,Potential future fund,UBS PFG - Global Funds Coming to Market_Q1 2026.pdf,15,Swan Investment Partners Fund I 300m* Held Close,70,real fund name; manager found; target size found
Housatonic Equity Investors VII 241m 2020,HCI Equity Partners V 405m 2017,,241m,241.0,,,,Potential future fund,UBS PFG - Global Funds Coming to Market_Q1 2026.pdf,15,Housatonic Equity Investors VII 241m 2020,70,real fund name; manager found; target size found
Milestone Partners FS 240m 2019,HKW Capital Partners V 365m 2019,,240m,240.0,,,,Potential future fund,UBS PFG - Global Funds Coming to Market_Q1 2026.pdf,15,Milestone Partners FS 240m 2019,70,real fund name; manager found; target size found
CCMP Capital Investors IV 500m 2022,,,500m,500.0,,,,Potential future fund,UBS PFG - Global Funds Coming to Market_Q1 2026.pdf,16,CCMP Capital Investors IV 500m 2022,70,real fund name; manager found; target size found
May River Capital Fund III 500m 2023,,,500m,500.0,,,,Potential future fund,UBS PFG - Global Funds Coming to Market_Q1 2026.pdf,16,May River Capital Fund III 500m 2023,70,real fund name; manager found; target size found
ShoreView Capital Partners V 500m,TriWest Capital Partners VI 237m 2023,,500m,500.0,,,,Potential future fund,UBS PFG - Global Funds Coming to Market_Q1 2026.pdf,16,ShoreView Capital Partners V 500m 2024,70,real fund name; manager found; target size found
Shoreline Equity Partners Fund II 450m 2023,,,450m,450.0,,,,Potential future fund,UBS PFG - Global Funds Coming to Market_Q1 2026.pdf,16,Shoreline Equity Partners Fund II 450m 2023,70,real fund name; manager found; target size found
Pfingsten Fund VI 435m 2022,CCMP Capital Investors IV 500m 2022,,435m,435.0,,,,Potential future fund,UBS PFG - Global Funds Coming to Market_Q1 2026.pdf,16,Pfingsten Fund VI 435m 2022,70,real fund name; manager found; target size found
Saw Mill Capital Partners III 435m 2022,CCMP Capital Investors IV 500m 2022,,435m,435.0,,,,Potential future fund,UBS PFG - Global Funds Coming to Market_Q1 2026.pdf,16,Saw Mill Capital Partners III 435m 2022,70,real fund name; manager found; target size found
Peloton Capital Management Fund II 405m 2023,Harbour Group Investments VIII 424m 2023,,405m,405.0,,,,Potential future fund,UBS PFG - Global Funds Coming to Market_Q1 2026.pdf,16,Peloton Capital Management Fund II 405m 2023,70,real fund name; manager found; target size found
Interlock Fund I 390m 2021,,,390m,390.0,,,,Potential future fund,UBS PFG - Global Funds Coming to Market_Q1 2026.pdf,16,Interlock Fund I 390m 2021,70,real fund name; manager found; target size found
Charger Investment Partners Fund I 376m 2021,,,376m,376.0,,,,Potential future fund,UBS PFG - Global Funds Coming to Market_Q1 2026.pdf,16,Charger Investment Partners Fund I 376m 2021,70,real fund name; manager found; target size found
GCP Capital Partners V 340m,,,340m,340.0,,,,Potential future fund,UBS PFG - Global Funds Coming to Market_Q1 2026.pdf,16,GCP Capital Partners V 340m 2024,70,real fund name; manager found; target size found
Edgewater Growth Capital Partners V 330m 2023 SFW Capital Partners Fund III 300m 2023,,growth,330m,330.0,,,,Potential future fund,UBS PFG - Global Funds Coming to Market_Q1 2026.pdf,16,Edgewater Growth Capital Partners V 330m 2023 SFW Capital Partners Fund III 300m 2023,70,real fund name; manager found; target size found
Platte River Equity V 321m,,,321m,321.0,,,,Potential future fund,UBS PFG - Global Funds Coming to Market_Q1 2026.pdf,16,Platte River Equity V 321m 2024,70,real fund name; manager found; target size found
Astara Capital Partners Fund I 312m 2022,Saw Mill Capital Partners III 435m 2022,,312m,312.0,,,,Potential future fund,UBS PFG - Global Funds Coming to Market_Q1 2026.pdf,16,Astara Capital Partners Fund I 312m 2022,70,real fund name; manager found; target size found
Rainier Partners Fund I 300m 2021,,,300m,300.0,,,,Potential future fund,UBS PFG - Global Funds Coming to Market_Q1 2026.pdf,16,Rainier Partners Fund I 300m 2021,70,real fund name; manager found; target size found
TriWest Capital Partners VI 237m 2023,,,237m,237.0,,,,Potential future fund,UBS PFG - Global Funds Coming to Market_Q1 2026.pdf,16,TriWest Capital Partners VI 237m 2023,70,real fund name; manager found; target size found
Vista Foundation Fund V 4.0bn* Raising,ABS Capital Partners IX 250m* Held Close,,4.0bn,4000.0,,,,Potential future fund,UBS PFG - Global Funds Coming to Market_Q1 2026.pdf,17,Vista Foundation Fund V 4.0bn* Raising,70,real fund name; manager found; target size found
Motive Capital Fund III 3.3bn* Raising,ABS Capital Partners IX 250m* Held Close,,3.3bn,3300.0,,,,Potential future fund,UBS PFG - Global Funds Coming to Market_Q1 2026.pdf,17,Motive Capital Fund III 3.3bn* Raising,70,real fund name; manager found; target size found
US Innovative Technology Fund II 2.5bn* Held Close,North American Growth Equity Universe,technology,2.5bn,2500.0,,,,Potential future fund,UBS PFG - Global Funds Coming to Market_Q1 2026.pdf,17,US Innovative Technology Fund II 2.5bn* Held Close,70,real fund name; manager found; target size found
Bonaccord Capital Partners III 1.6bn* Held Close,North American Growth Equity Universe,,1.6bn,1600.0,,,,Potential future fund,UBS PFG - Global Funds Coming to Market_Q1 2026.pdf,17,Bonaccord Capital Partners III 1.6bn* Held Close,70,real fund name; manager found; target size found
Chicago Pacific Founders Fund IV 1.2bn* Raising,,,1.2bn,1200.0,,,,Potential future fund,UBS PFG - Global Funds Coming to Market_Q1 2026.pdf,17,Chicago Pacific Founders Fund IV 1.2bn* Raising,70,real fund name; manager found; target size found
H.I.G. Small-Cap & Growth Buyout Fund IV 1.2bn* Raising,,"buyout, growth",1.2bn,1200.0,,,,Potential future fund,UBS PFG - Global Funds Coming to Market_Q1 2026.pdf,17,H.I.G. Small-Cap & Growth Buyout Fund IV 1.2bn* Raising,70,real fund name; manager found; target size found
Avance Investment Partners II 1.0bn* Raising,,,1.0bn,1000.0,,,,Potential future fund,UBS PFG - Global Funds Coming to Market_Q1 2026.pdf,17,Avance Investment Partners II 1.0bn* Raising,70,real fund name; manager found; target size found
PeakSpan Capital Growth Partners IV 800m* Raising,Avance Investment Partners II 1.0bn* Raising,growth,800m,800.0,,,,Potential future fund,UBS PFG - Global Funds Coming to Market_Q1 2026.pdf,17,PeakSpan Capital Growth Partners IV 800m* Raising,70,real fund name; manager found; target size found
GPI Capital Equity Opportunities Fund II 750m* Held Close,Bonaccord Capital Partners III 1.6bn* Held Close,,750m,750.0,,,,Potential future fund,UBS PFG - Global Funds Coming to Market_Q1 2026.pdf,17,GPI Capital Equity Opportunities Fund II 750m* Held Close,70,real fund name; manager found; target size found
Banneker Partners Fund III 750m* Raising,PeakSpan Capital Growth Partners IV 800m* Raising,,750m,750.0,,,,Potential future fund,UBS PFG - Global Funds Coming to Market_Q1 2026.pdf,17,Banneker Partners Fund III 750m* Raising,70,real fund name; manager found; target size found
Smash Capital Fund II 500m* Held Close,,,500m,500.0,,,,Potential future fund,UBS PFG - Global Funds Coming to Market_Q1 2026.pdf,17,Smash Capital Fund II 500m* Held Close,70,real fund name; manager found; target size found
50T Fund V 500m* Raising,,,500m,500.0,,,,Potential future fund,UBS PFG - Global Funds Coming to Market_Q1 2026.pdf,17,50T Fund V 500m* Raising,70,real fund name; manager found; target size found
HV Acceleration Fund II 500m* Raising,,,500m,500.0,,,,Potential future fund,UBS PFG - Global Funds Coming to Market_Q1 2026.pdf,17,HV Acceleration Fund II 500m* Raising,70,real fund name; manager found; target size found
Halifax Capital Partners V 445m* Held Close,,,445m,445.0,,,,Potential future fund,UBS PFG - Global Funds Coming to Market_Q1 2026.pdf,17,Halifax Capital Partners V 445m* Held Close,70,real fund name; manager found; target size found
Ten Coves Capital IV 350m* Held Close,Halifax Capital Partners V 445m* Held Close,,350m,350.0,,,,Potential future fund,UBS PFG - Global Funds Coming to Market_Q1 2026.pdf,17,Ten Coves Capital IV 350m* Held Close,70,real fund name; manager found; target size found
ABS Capital Partners IX 250m* Held Close,Ten Coves Capital IV 350m* Held Close,,250m,250.0,,,,Potential future fund,UBS PFG - Global Funds Coming to Market_Q1 2026.pdf,17,ABS Capital Partners IX 250m* Held Close,70,real fund name; manager found; target size found
TPG Growth VI 4.8bn 2023,,growth,4.8bn,4800.0,,,,Potential future fund,UBS PFG - Global Funds Coming to Market_Q1 2026.pdf,18,TPG Growth VI 4.8bn 2023,70,real fund name; manager found; target size found
RedBird Capital Partners Fund IV 4.7bn 2022,,,4.7bn,4700.0,,,,Potential future fund,UBS PFG - Global Funds Coming to Market_Q1 2026.pdf,18,RedBird Capital Partners Fund IV 4.7bn 2022,70,real fund name; manager found; target size found
Ara Fund III 2.8bn 2023,,,2.8bn,2800.0,,,,Potential future fund,UBS PFG - Global Funds Coming to Market_Q1 2026.pdf,18,Ara Fund III 2.8bn 2023,70,real fund name; manager found; target size found
Bond Capital Fund III 2.5bn 2022,,,2.5bn,2500.0,,,,Potential future fund,UBS PFG - Global Funds Coming to Market_Q1 2026.pdf,18,Bond Capital Fund III 2.5bn 2022,70,real fund name; manager found; target size found
Apax Digital Fund II 2.0bn 2021,,,2.0bn,2000.0,,,,Potential future fund,UBS PFG - Global Funds Coming to Market_Q1 2026.pdf,18,Apax Digital Fund II 2.0bn 2021,70,real fund name; manager found; target size found
Spectrum Equity X 2.0bn 2022,,,2.0bn,2000.0,,,,Potential future fund,UBS PFG - Global Funds Coming to Market_Q1 2026.pdf,18,Spectrum Equity X 2.0bn 2022,70,real fund name; manager found; target size found
Brighton Park Capital Fund II 1.8bn 2022,Spectrum Equity X 2.0bn 2022,,1.8bn,1800.0,,,,Potential future fund,UBS PFG - Global Funds Coming to Market_Q1 2026.pdf,18,Brighton Park Capital Fund II 1.8bn 2022,70,real fund name; manager found; target size found
Anthos Capital V 1.6bn 2021,,,1.6bn,1600.0,,,,Potential future fund,UBS PFG - Global Funds Coming to Market_Q1 2026.pdf,18,Anthos Capital V 1.6bn 2021,70,real fund name; manager found; target size found
Sightway Capital Fund I 1.2bn 2019,,,1.2bn,1200.0,,,,Potential future fund,UBS PFG - Global Funds Coming to Market_Q1 2026.pdf,18,Sightway Capital Fund I 1.2bn 2019,70,real fund name; manager found; target size found
WestView Capital Partners V 1.0bn 2023,,,1.0bn,1000.0,,,,Potential future fund,UBS PFG - Global Funds Coming to Market_Q1 2026.pdf,18,WestView Capital Partners V 1.0bn 2023,70,real fund name; manager found; target size found
Georgian Partners Growth Fund VI 900m 2021,Anthos Capital V 1.6bn 2021,growth,900m,900.0,,,,Potential future fund,UBS PFG - Global Funds Coming to Market_Q1 2026.pdf,18,Georgian Partners Growth Fund VI 900m 2021,70,real fund name; manager found; target size found
Raine Partners IV 763m 2022,,,763m,763.0,,,,Potential future fund,UBS PFG - Global Funds Coming to Market_Q1 2026.pdf,18,Raine Partners IV 763m 2022,70,real fund name; manager found; target size found
