fund_name,manager_name,fund_strategy,target_size_display,target_size_millions,currency,expected_quarter,expected_year,status,source_file,source_page,raw_line,quality_score,quality_reason
TA Realty Value-Add Fund XIV 2.0bn* Raising,,,2.0bn,2000.0,,,,Potential future fund,UBS PFG - Global Funds Coming to Market_Q1 2026.pdf,48,TA Realty Value-Add Fund XIV 2.0bn* Raising,70,real fund name; manager found; target size found
Greystar Equity Partners XI 1.9bn 2022,,,1.9bn,1900.0,,,,Potential future fund,UBS PFG - Global Funds Coming to Market_Q1 2026.pdf,48,Greystar Equity Partners XI 1.9bn 2022,70,real fund name; manager found; target size found
Cabot Industrial Value Fund VIII 1.8bn* Raising,,industrial,1.8bn,1800.0,,,,Potential future fund,UBS PFG - Global Funds Coming to Market_Q1 2026.pdf,48,Cabot Industrial Value Fund VIII 1.8bn* Raising,70,real fund name; manager found; target size found
Waterton Residential Property Venture XV 1.7bn 2022,Greystar Equity Partners XI 1.9bn 2022,venture,1.7bn,1700.0,,,,Potential future fund,UBS PFG - Global Funds Coming to Market_Q1 2026.pdf,48,Waterton Residential Property Venture XV 1.7bn 2022,70,real fund name; manager found; target size found
Bridge Logistics Value Fund II 1.5bn* Held Close,Heitman Value Partners VI 2.0bn* Held Close,,1.5bn,1500.0,,,,Potential future fund,UBS PFG - Global Funds Coming to Market_Q1 2026.pdf,48,Bridge Logistics Value Fund II 1.5bn* Held Close,70,real fund name; manager found; target size found
Carmel Partners Investment Fund IX 1.5bn* Held Close,Heitman Value Partners VI 2.0bn* Held Close,,1.5bn,1500.0,,,,Potential future fund,UBS PFG - Global Funds Coming to Market_Q1 2026.pdf,48,Carmel Partners Investment Fund IX 1.5bn* Held Close,70,real fund name; manager found; target size found
Cortland Enhanced Value Fund VI 1.5bn 2023,Greystar Equity Partners XI 1.9bn 2022,,1.5bn,1500.0,,,,Potential future fund,UBS PFG - Global Funds Coming to Market_Q1 2026.pdf,48,Cortland Enhanced Value Fund VI 1.5bn 2023,70,real fund name; manager found; target size found
Rockwood Capital Real Estate Partners Fund XII 1.4bn* Held Close,,real estate,1.4bn,1400.0,,,,Potential future fund,UBS PFG - Global Funds Coming to Market_Q1 2026.pdf,48,Rockwood Capital Real Estate Partners Fund XII 1.4bn* Held Close,70,real fund name; manager found; target size found
LaSalle Value Partners U.S. IX 1.3bn* Held Close,,,1.3bn,1300.0,,,,Potential future fund,UBS PFG - Global Funds Coming to Market_Q1 2026.pdf,48,LaSalle Value Partners U.S. IX 1.3bn* Held Close,70,real fund name; manager found; target size found
FCP Realty Fund VI 1.1bn 2023,Greystar Equity Partners XI 1.9bn 2022,,1.1bn,1100.0,,,,Potential future fund,UBS PFG - Global Funds Coming to Market_Q1 2026.pdf,48,FCP Realty Fund VI 1.1bn 2023,70,real fund name; manager found; target size found
American Landmark Fund V 1.0bn* Held Close,LaSalle Value Partners U.S. IX 1.3bn* Held Close,,1.0bn,1000.0,,,,Potential future fund,UBS PFG - Global Funds Coming to Market_Q1 2026.pdf,48,American Landmark Fund V 1.0bn* Held Close,70,real fund name; manager found; target size found
Dermody Properties Industrial Fund IV 1.0bn 2022,Greystar Equity Partners XI 1.9bn 2022,industrial,1.0bn,1000.0,,,,Potential future fund,UBS PFG - Global Funds Coming to Market_Q1 2026.pdf,48,Dermody Properties Industrial Fund IV 1.0bn 2022,70,real fund name; manager found; target size found
Pretium Residential Acquisition Fund 1.0bn 2023,Sealy Industrial Partners IV 750m* Held Close,,1.0bn,1000.0,,,,Potential future fund,UBS PFG - Global Funds Coming to Market_Q1 2026.pdf,49,Pretium Residential Acquisition Fund 1.0bn 2023,70,real fund name; manager found; target size found
First Hospitality Group - Hotel Investment Fund 1.0bn,West Street Real Estate Investment Partners 3.5bn 2021,,1.0bn,1000.0,,,,Potential future fund,UBS PFG - Global Funds Coming to Market_Q1 2026.pdf,49,First Hospitality Group - Hotel Investment Fund 1.0bn 2024,70,real fund name; manager found; target size found
Bell Core Fund I 930m 2021,Sealy Industrial Partners IV 750m* Held Close,,930m,930.0,,,,Potential future fund,UBS PFG - Global Funds Coming to Market_Q1 2026.pdf,49,Bell Core Fund I 930m 2021,70,real fund name; manager found; target size found
Rose Affordable Housing Preservation Fund VI 660m 2023,Sealy Industrial Partners IV 750m* Held Close,,660m,660.0,,,,Potential future fund,UBS PFG - Global Funds Coming to Market_Q1 2026.pdf,49,Rose Affordable Housing Preservation Fund VI 660m 2023,70,real fund name; manager found; target size found
Peachtree Strategic Opportunity Fund 500m* Held Close,Sealy Industrial Partners IV 750m* Held Close,,500m,500.0,,,,Potential future fund,UBS PFG - Global Funds Coming to Market_Q1 2026.pdf,49,Peachtree Strategic Opportunity Fund 500m* Held Close,70,real fund name; manager found; target size found
O'Connor Retail Fund II 500m 2019,Sealy Industrial Partners IV 750m* Held Close,,500m,500.0,,,,Potential future fund,UBS PFG - Global Funds Coming to Market_Q1 2026.pdf,49,O'Connor Retail Fund II 500m 2019,70,real fund name; manager found; target size found
Lexington Capital Partners XI 25.0bn* Raising,,,25.0bn,25000.0,,,,Potential future fund,UBS PFG - Global Funds Coming to Market_Q1 2026.pdf,50,Lexington Capital Partners XI 25.0bn* Raising,70,real fund name; manager found; target size found
Strategic Partners Fund X 22.0bn* Raising,Lexington Capital Partners XI 25.0bn* Raising,,22.0bn,22000.0,,,,Potential future fund,UBS PFG - Global Funds Coming to Market_Q1 2026.pdf,50,Strategic Partners Fund X 22.0bn* Raising,70,real fund name; manager found; target size found
Partners Group Secondary VIII 10.0bn* Raising,,,10.0bn,10000.0,,,,Potential future fund,UBS PFG - Global Funds Coming to Market_Q1 2026.pdf,50,Partners Group Secondary VIII 10.0bn* Raising,70,real fund name; manager found; target size found
Hamilton Lane Secondary Fund VII 7.0bn* Raising,Partners Group Secondary VIII 10.0bn* Raising,,7.0bn,7000.0,,,,Potential future fund,UBS PFG - Global Funds Coming to Market_Q1 2026.pdf,50,Hamilton Lane Secondary Fund VII 7.0bn* Raising,70,real fund name; manager found; target size found
Pomona Capital XI 3.5bn* Held Close,,,3.5bn,3500.0,,,,Potential future fund,UBS PFG - Global Funds Coming to Market_Q1 2026.pdf,50,Pomona Capital XI 3.5bn* Held Close,70,real fund name; manager found; target size found
Portfolio Advisors Secondary Fund V 3.5bn* Held Close,Pomona Capital XI 3.5bn* Held Close,,3.5bn,3500.0,,,,Potential future fund,UBS PFG - Global Funds Coming to Market_Q1 2026.pdf,50,Portfolio Advisors Secondary Fund V 3.5bn* Held Close,70,real fund name; manager found; target size found
Newbury Equity Partners VI 2.5bn* Held Close,Pomona Capital XI 3.5bn* Held Close,,2.5bn,2500.0,,,,Potential future fund,UBS PFG - Global Funds Coming to Market_Q1 2026.pdf,50,Newbury Equity Partners VI 2.5bn* Held Close,70,real fund name; manager found; target size found
ACP Secondaries 6 2.0bn* Held Close,Newbury Equity Partners VI 2.5bn* Held Close,secondaries,2.0bn,2000.0,,,,Potential future fund,UBS PFG - Global Funds Coming to Market_Q1 2026.pdf,50,ACP Secondaries 6 2.0bn* Held Close,70,real fund name; manager found; target size found
Blue Owl Strategic Equity Partners Fund 2.0bn* Held Close,Newbury Equity Partners VI 2.5bn* Held Close,,2.0bn,2000.0,,,,Potential future fund,UBS PFG - Global Funds Coming to Market_Q1 2026.pdf,50,Blue Owl Strategic Equity Partners Fund 2.0bn* Held Close,70,real fund name; manager found; target size found
LSV Special Opportunities VII 1.8bn* Held Close,,,1.8bn,1800.0,,,,Potential future fund,UBS PFG - Global Funds Coming to Market_Q1 2026.pdf,50,LSV Special Opportunities VII 1.8bn* Held Close,70,real fund name; manager found; target size found
Apogem PA Secondary Fund VII 1.3bn* Held Close,,,1.3bn,1300.0,,,,Potential future fund,UBS PFG - Global Funds Coming to Market_Q1 2026.pdf,50,Apogem PA Secondary Fund VII 1.3bn* Held Close,70,real fund name; manager found; target size found
Schroders Capital PE Continuation Opportunities III 1.0bn* Held Close,,continuation,1.0bn,1000.0,,,,Potential future fund,UBS PFG - Global Funds Coming to Market_Q1 2026.pdf,50,Schroders Capital PE Continuation Opportunities III 1.0bn* Held Close,70,real fund name; manager found; target size found
SQ Capital Fund I 1.0bn* Held Close,Schroders Capital PE Continuation Opportunities III 1.0bn* Held Close,,1.0bn,1000.0,,,,Potential future fund,UBS PFG - Global Funds Coming to Market_Q1 2026.pdf,50,SQ Capital Fund I 1.0bn* Held Close,70,real fund name; manager found; target size found
Sweetwater Secondaries Fund IV 650m* Held Close,,secondaries,650m,650.0,,,,Potential future fund,UBS PFG - Global Funds Coming to Market_Q1 2026.pdf,50,Sweetwater Secondaries Fund IV 650m* Held Close,70,real fund name; manager found; target size found
Committed Advisors GP Strategies Fund II 500m* Held Close,,,500m,500.0,,,,Potential future fund,UBS PFG - Global Funds Coming to Market_Q1 2026.pdf,50,Committed Advisors GP Strategies Fund II 500m* Held Close,70,real fund name; manager found; target size found
Patria Secondaries Opportunities Fund V 500m* Held Close,,secondaries,500m,500.0,,,,Potential future fund,UBS PFG - Global Funds Coming to Market_Q1 2026.pdf,50,Patria Secondaries Opportunities Fund V 500m* Held Close,70,real fund name; manager found; target size found
Timber Bay Fund III 400m* Held Close,,,400m,400.0,,,,Potential future fund,UBS PFG - Global Funds Coming to Market_Q1 2026.pdf,50,Timber Bay Fund III 400m* Held Close,70,real fund name; manager found; target size found
Ardian Secondary Fund IX 30.0bn 2022,,,30.0bn,30000.0,,,,Potential future fund,UBS PFG - Global Funds Coming to Market_Q1 2026.pdf,51,Ardian Secondary Fund IX 30.0bn 2022,70,real fund name; manager found; target size found
Idinvest Secondary Fund IV 1.1bn 2021 c,,,1.1bn,1100.0,,,,Potential future fund,UBS PFG - Global Funds Coming to Market_Q1 2026.pdf,51,Idinvest Secondary Fund IV 1.1bn 2021 c,70,real fund name; manager found; target size found
NorthSands Opportunities II 1.0bn* Raising,,,1.0bn,1000.0,,,,Potential future fund,UBS PFG - Global Funds Coming to Market_Q1 2026.pdf,51,NorthSands Opportunities II 1.0bn* Raising,70,real fund name; manager found; target size found
W Capital Partners VI 1.0bn* Raising,,,1.0bn,1000.0,,,,Potential future fund,UBS PFG - Global Funds Coming to Market_Q1 2026.pdf,51,W Capital Partners VI 1.0bn* Raising,70,real fund name; manager found; target size found
NewQuest Asia Fund V 987m 2022,,,987m,987.0,,,,Potential future fund,UBS PFG - Global Funds Coming to Market_Q1 2026.pdf,51,NewQuest Asia Fund V 987m 2022,70,real fund name; manager found; target size found
Headway Investment Partners V 653m 2022,,,653m,653.0,,,,Potential future fund,UBS PFG - Global Funds Coming to Market_Q1 2026.pdf,51,Headway Investment Partners V 653m 2022,70,real fund name; manager found; target size found
Fort Washington Private Equity Opportunities Fund V 400m* Raising,W Capital Partners VI 1.0bn* Raising,private equity,400m,400.0,,,,Potential future fund,UBS PFG - Global Funds Coming to Market_Q1 2026.pdf,51,Fort Washington Private Equity Opportunities Fund V 400m* Raising,70,real fund name; manager found; target size found
Auldbrass Partners Secondary Opportunity Fund IV 350m* Raising,,,350m,350.0,,,,Potential future fund,UBS PFG - Global Funds Coming to Market_Q1 2026.pdf,51,Auldbrass Partners Secondary Opportunity Fund IV 350m* Raising,70,real fund name; manager found; target size found
Flexstone Mid-Market Secondaries Fund III 154m 2022,,secondaries,154m,154.0,,,,Potential future fund,UBS PFG - Global Funds Coming to Market_Q1 2026.pdf,51,Flexstone Mid-Market Secondaries Fund III 154m 2022,70,real fund name; manager found; target size found
Foundation Private Equity Fund 1 119m 2021,,private equity,119m,119.0,,,,Potential future fund,UBS PFG - Global Funds Coming to Market_Q1 2026.pdf,51,Foundation Private Equity Fund 1 119m 2021,70,real fund name; manager found; target size found
AlpInvest Secondaries Program VIII 20.2bn 2023,,secondaries,20.2bn,20200.0,,,,Potential future fund,UBS PFG - Global Funds Coming to Market_Q1 2026.pdf,52,AlpInvest Secondaries Program VIII 20.2bn 2023,70,real fund name; manager found; target size found
Coller International Partners IX 12.5bn c,,,12.5bn,12500.0,,,,Potential future fund,UBS PFG - Global Funds Coming to Market_Q1 2026.pdf,52,Coller International Partners IX 12.5bn 2024 c,70,real fund name; manager found; target size found
ICG Strategic Equity Fund V 11.0bn 2023,,,11.0bn,11000.0,,,,Potential future fund,UBS PFG - Global Funds Coming to Market_Q1 2026.pdf,52,ICG Strategic Equity Fund V 11.0bn 2023,70,real fund name; manager found; target size found
Crown Global Secondaries VI 7.5bn,,secondaries,7.5bn,7500.0,,,,Potential future fund,UBS PFG - Global Funds Coming to Market_Q1 2026.pdf,52,Crown Global Secondaries VI 7.5bn 2024,70,real fund name; manager found; target size found
Apollo S3 Equity & Hybrid Solutions Fund 5.4bn 2023,,,5.4bn,5400.0,,,,Potential future fund,UBS PFG - Global Funds Coming to Market_Q1 2026.pdf,52,Apollo S3 Equity & Hybrid Solutions Fund 5.4bn 2023,70,real fund name; manager found; target size found
NB Strategic Capital II 4.0bn 2023 c,,,4.0bn,4000.0,,,,Potential future fund,UBS PFG - Global Funds Coming to Market_Q1 2026.pdf,52,NB Strategic Capital II 4.0bn 2023 c,70,real fund name; manager found; target size found
BlackRock Secondaries & Liquidity Solutions II 3.1bn 2023,NB Strategic Capital II 4.0bn 2023 c,secondaries,3.1bn,3100.0,,,,Potential future fund,UBS PFG - Global Funds Coming to Market_Q1 2026.pdf,52,BlackRock Secondaries & Liquidity Solutions II 3.1bn 2023,70,real fund name; manager found; target size found
Private Equity Strategic Opportunities Fund V 1.2bn 2023 c,NB Strategic Capital II 4.0bn 2023 c,private equity,1.2bn,1200.0,,,,Potential future fund,UBS PFG - Global Funds Coming to Market_Q1 2026.pdf,52,Private Equity Strategic Opportunities Fund V 1.2bn 2023 c,70,real fund name; manager found; target size found
Commonfund Secondary Partners IV 1.1bn 2023,,,1.1bn,1100.0,,,,Potential future fund,UBS PFG - Global Funds Coming to Market_Q1 2026.pdf,52,Commonfund Secondary Partners IV 1.1bn 2023,70,real fund name; manager found; target size found
Arcano Secondary Fund V 987m,,,987m,987.0,,,,Potential future fund,UBS PFG - Global Funds Coming to Market_Q1 2026.pdf,52,Arcano Secondary Fund V 987m 2024,70,real fund name; manager found; target size found
Dorchester Credit Secondaries VI 900m 2023,,"credit, secondaries",900m,900.0,,,,Potential future fund,UBS PFG - Global Funds Coming to Market_Q1 2026.pdf,52,Dorchester Credit Secondaries VI 900m 2023,70,real fund name; manager found; target size found
Aquilius Investment Partners Secondary Fund II 750m,,,750m,750.0,,,,Potential future fund,UBS PFG - Global Funds Coming to Market_Q1 2026.pdf,52,Aquilius Investment Partners Secondary Fund II 750m 2024,70,real fund name; manager found; target size found
Nova Private Equity Partners IV 635m,,private equity,635m,635.0,,,,Potential future fund,UBS PFG - Global Funds Coming to Market_Q1 2026.pdf,52,Nova Private Equity Partners IV 635m 2024,70,real fund name; manager found; target size found
Golding Secondaries 2022 603m 2023 c,,secondaries,603m,603.0,,,,Potential future fund,UBS PFG - Global Funds Coming to Market_Q1 2026.pdf,52,Golding Secondaries 2022 603m 2023 c,70,real fund name; manager found; target size found
Abbott Secondaries Opportunities III 380m,,secondaries,380m,380.0,,,,Potential future fund,UBS PFG - Global Funds Coming to Market_Q1 2026.pdf,52,Abbott Secondaries Opportunities III 380m 2024,70,real fund name; manager found; target size found
CVC Capital Partners IX €26.8bn 2023,,,€26.8bn,26800.0,EUR,,,Potential future fund,UBS PFG - Global Funds Coming to Market_Q1 2026.pdf,54,CVC Capital Partners IX €26.8bn 2023,70,real fund name; manager found; target size found
KKR Europe Fund VI $7.3bn 2022,,,$7.3bn,7300.0,USD,,,Potential future fund,UBS PFG - Global Funds Coming to Market_Q1 2026.pdf,54,KKR Europe Fund VI $7.3bn 2022,70,real fund name; manager found; target size found
Ardian Buyout VII €6.5bn 2019,,buyout,€6.5bn,6500.0,EUR,,,Potential future fund,UBS PFG - Global Funds Coming to Market_Q1 2026.pdf,55,Ardian Buyout VII €6.5bn 2019,70,real fund name; manager found; target size found
Bain Capital Europe VI €6.4bn 2023,,,€6.4bn,6400.0,EUR,,,Potential future fund,UBS PFG - Global Funds Coming to Market_Q1 2026.pdf,55,Bain Capital Europe VI €6.4bn 2023,70,real fund name; manager found; target size found
TDR Capital V €4.3bn 2023,,,€4.3bn,4300.0,EUR,,,Potential future fund,UBS PFG - Global Funds Coming to Market_Q1 2026.pdf,55,TDR Capital V €4.3bn 2023,70,real fund name; manager found; target size found
Waterland Private Equity Fund X €4.0bn* Raising,,private equity,€4.0bn,4000.0,EUR,,,Potential future fund,UBS PFG - Global Funds Coming to Market_Q1 2026.pdf,55,Waterland Private Equity Fund X €4.0bn* Raising,70,real fund name; manager found; target size found
Inflexion Buyout Fund VII €3.5bn* Raising,,buyout,€3.5bn,3500.0,EUR,,,Potential future fund,UBS PFG - Global Funds Coming to Market_Q1 2026.pdf,55,Inflexion Buyout Fund VII €3.5bn* Raising,70,real fund name; manager found; target size found
Carlyle Europe Technology Partners V €3.1bn 2023,,technology,€3.1bn,3100.0,EUR,,,Potential future fund,UBS PFG - Global Funds Coming to Market_Q1 2026.pdf,55,Carlyle Europe Technology Partners V €3.1bn 2023,70,real fund name; manager found; target size found
EMK Capital Partners III €3.0bn 2023,,,€3.0bn,3000.0,EUR,,,Potential future fund,UBS PFG - Global Funds Coming to Market_Q1 2026.pdf,55,EMK Capital Partners III €3.0bn 2023,70,real fund name; manager found; target size found
Castik Capital III €2.0bn,,,€2.0bn,2000.0,EUR,,,Potential future fund,UBS PFG - Global Funds Coming to Market_Q1 2026.pdf,56,Castik Capital III €2.0bn 2024,70,real fund name; manager found; target size found
Nordic Capital Evolution Fund II €2.0bn,,,€2.0bn,2000.0,EUR,,,Potential future fund,UBS PFG - Global Funds Coming to Market_Q1 2026.pdf,56,Nordic Capital Evolution Fund II €2.0bn 2024,70,real fund name; manager found; target size found
Main Capital VIII €1.9bn,,,€1.9bn,1900.0,EUR,,,Potential future fund,UBS PFG - Global Funds Coming to Market_Q1 2026.pdf,56,Main Capital VIII €1.9bn 2024,70,real fund name; manager found; target size found
Summit Partners Europe Growth Equity Fund IV €1.4bn 2023,,growth,€1.4bn,1400.0,EUR,,,Potential future fund,UBS PFG - Global Funds Coming to Market_Q1 2026.pdf,56,Summit Partners Europe Growth Equity Fund IV €1.4bn 2023,70,real fund name; manager found; target size found
Epiris Fund III £1.0bn 2022,,,£1.0bn,1000.0,GBP,,,Potential future fund,UBS PFG - Global Funds Coming to Market_Q1 2026.pdf,56,Epiris Fund III £1.0bn 2022,70,real fund name; manager found; target size found
MML Partnership Capital Fund VIII €1.0bn 2023,,,€1.0bn,1000.0,EUR,,,Potential future fund,UBS PFG - Global Funds Coming to Market_Q1 2026.pdf,56,MML Partnership Capital Fund VIII €1.0bn 2023,70,real fund name; manager found; target size found
Triton Smaller Mid-Cap Fund II €817m 2021,,,€817m,817.0,EUR,,,Potential future fund,UBS PFG - Global Funds Coming to Market_Q1 2026.pdf,56,Triton Smaller Mid-Cap Fund II €817m 2021,70,real fund name; manager found; target size found
Charme Fund IV €780m 2023,,,€780m,780.0,EUR,,,Potential future fund,UBS PFG - Global Funds Coming to Market_Q1 2026.pdf,56,Charme Fund IV €780m 2023,70,real fund name; manager found; target size found
Freshstream Fund II €762m 2021,,,€762m,762.0,EUR,,,Potential future fund,UBS PFG - Global Funds Coming to Market_Q1 2026.pdf,56,Freshstream Fund II €762m 2021,70,real fund name; manager found; target size found
Preservation Capital Partners Fund III €700m* Raising,,,€700m,700.0,EUR,,,Potential future fund,UBS PFG - Global Funds Coming to Market_Q1 2026.pdf,56,Preservation Capital Partners Fund III €700m* Raising,70,real fund name; manager found; target size found
KLAR Partners II €870m,,,€870m,870.0,EUR,,,Potential future fund,UBS PFG - Global Funds Coming to Market_Q1 2026.pdf,57,KLAR Partners II €870m 2024,70,real fund name; manager found; target size found
Volpi Capital Fund III €428m,,,€428m,428.0,EUR,,,Potential future fund,UBS PFG - Global Funds Coming to Market_Q1 2026.pdf,57,Volpi Capital Fund III €428m 2024,70,real fund name; manager found; target size found
Tikehau Decarbonization Fund II €2500m* Raising,,,€2500m,2500.0,EUR,,,Potential future fund,UBS PFG - Global Funds Coming to Market_Q1 2026.pdf,58,Tikehau Decarbonization Fund II €2500m* Raising,70,real fund name; manager found; target size found
Summa Equity III €2.3bn 2021,,,€2.3bn,2300.0,EUR,,,Potential future fund,UBS PFG - Global Funds Coming to Market_Q1 2026.pdf,58,Summa Equity III €2.3bn 2021,70,real fund name; manager found; target size found
2150 Urban Tech Sustainability Fund II Not disclosed Held Close,,,2150,2150.0,,,,Potential future fund,UBS PFG - Global Funds Coming to Market_Q1 2026.pdf,58,2150 Urban Tech Sustainability Fund II Not disclosed Held Close,70,real fund name; manager found; target size found
Generation IM Sustainable Solutions Fund IV $1.7bn 2022,,,$1.7bn,1700.0,USD,,,Potential future fund,UBS PFG - Global Funds Coming to Market_Q1 2026.pdf,58,Generation IM Sustainable Solutions Fund IV $1.7bn 2022,70,real fund name; manager found; target size found
Bain Capital Double Impact Fund III $1.0bn* Held Close,,,$1.0bn,1000.0,USD,,,Potential future fund,UBS PFG - Global Funds Coming to Market_Q1 2026.pdf,58,Bain Capital Double Impact Fund III $1.0bn* Held Close,70,real fund name; manager found; target size found
OGCI Decarbonization Acceleration Fund $750m* Raising,,,$750m,750.0,USD,,,Potential future fund,UBS PFG - Global Funds Coming to Market_Q1 2026.pdf,58,OGCI Decarbonization Acceleration Fund $750m* Raising,70,real fund name; manager found; target size found
Capricorn Technology Impact Fund II $510m 2021,,technology,$510m,510.0,USD,,,Potential future fund,UBS PFG - Global Funds Coming to Market_Q1 2026.pdf,58,Capricorn Technology Impact Fund II $510m 2021,70,real fund name; manager found; target size found
LeapFrog Climate Fund $500m* Held Close,,climate,$500m,500.0,USD,,,Potential future fund,UBS PFG - Global Funds Coming to Market_Q1 2026.pdf,58,LeapFrog Climate Fund $500m* Held Close,70,real fund name; manager found; target size found
Partners Group Life II $500m* Held Close,,,$500m,500.0,USD,,,Potential future fund,UBS PFG - Global Funds Coming to Market_Q1 2026.pdf,58,Partners Group Life II $500m* Held Close,70,real fund name; manager found; target size found
IMPACT Growth V €400m* Held Close,,growth,€400m,400.0,EUR,,,Potential future fund,UBS PFG - Global Funds Coming to Market_Q1 2026.pdf,58,IMPACT Growth V €400m* Held Close,70,real fund name; manager found; target size found
Nuveen Climate Inclusion Fund II $400m* Held Close,,climate,$400m,400.0,USD,,,Potential future fund,UBS PFG - Global Funds Coming to Market_Q1 2026.pdf,58,Nuveen Climate Inclusion Fund II $400m* Held Close,70,real fund name; manager found; target size found
Adjuvant Global Health Technology Fund $300m 2019,,technology,$300m,300.0,USD,,,Potential future fund,UBS PFG - Global Funds Coming to Market_Q1 2026.pdf,58,Adjuvant Global Health Technology Fund $300m 2019,70,real fund name; manager found; target size found
Environment Technologies Fund 4 €285m 2022,,,€285m,285.0,EUR,,,Potential future fund,UBS PFG - Global Funds Coming to Market_Q1 2026.pdf,58,Environment Technologies Fund 4 €285m 2022,70,real fund name; manager found; target size found
T2Y Capital I €200m* Held Close,,,€200m,200.0,EUR,,,Potential future fund,UBS PFG - Global Funds Coming to Market_Q1 2026.pdf,58,T2Y Capital I €200m* Held Close,70,real fund name; manager found; target size found
Vertevis Impact Investment Fund I €200m* Raising,,,€200m,200.0,EUR,,,Potential future fund,UBS PFG - Global Funds Coming to Market_Q1 2026.pdf,58,Vertevis Impact Investment Fund I €200m* Raising,70,real fund name; manager found; target size found
responsAbility Access to Clean Power Fund $159m 2020,,,$159m,159.0,USD,,,Potential future fund,UBS PFG - Global Funds Coming to Market_Q1 2026.pdf,58,responsAbility Access to Clean Power Fund $159m 2020,70,real fund name; manager found; target size found
Allianz Impact Investment Fund €130m 2020,,,€130m,130.0,EUR,,,Potential future fund,UBS PFG - Global Funds Coming to Market_Q1 2026.pdf,58,Allianz Impact Investment Fund €130m 2020,70,real fund name; manager found; target size found
Alder Fund III SEK 3.1bn 2023,,,3.1bn,3100.0,,,,Potential future fund,UBS PFG - Global Funds Coming to Market_Q1 2026.pdf,59,Alder Fund III SEK 3.1bn 2023,70,real fund name; manager found; target size found
KKR Global Impact Fund II $3.0bn 2023,,,$3.0bn,3000.0,USD,,,Potential future fund,UBS PFG - Global Funds Coming to Market_Q1 2026.pdf,59,KKR Global Impact Fund II $3.0bn 2023,70,real fund name; manager found; target size found
Ara Fund III $2.8bn 2023,,,$2.8bn,2800.0,USD,,,Potential future fund,UBS PFG - Global Funds Coming to Market_Q1 2026.pdf,59,Ara Fund III $2.8bn 2023,70,real fund name; manager found; target size found
Planet First Partners I €450m 2023,,,€450m,450.0,EUR,,,Potential future fund,UBS PFG - Global Funds Coming to Market_Q1 2026.pdf,59,Planet First Partners I €450m 2023,70,real fund name; manager found; target size found
Vidia Climate Fund I €415m,,climate,€415m,415.0,EUR,,,Potential future fund,UBS PFG - Global Funds Coming to Market_Q1 2026.pdf,59,Vidia Climate Fund I €415m 2024,70,real fund name; manager found; target size found
